{
  "$schema": "https://json-schema.org/draft/2020-12/schema",
  "$id": "https://danyanpihuihui.github.io/organa-cell-7187/versions/0.3.0/schemas/organa-registry-v0.1.schema.json",
  "title": "Organa Registry v0.1",
  "type": "object",
  "required": [
    "schema_version",
    "coordinate",
    "registry_type",
    "entries"
  ],
  "properties": {
    "schema_version": {
      "const": "organa-registry-v0.1"
    },
    "coordinate": {
      "type": "string",
      "pattern": "^[0-9]+\\.bitmap$"
    },
    "registry_type": {
      "enum": [
        "agents",
        "services",
        "proofs"
      ]
    },
    "entries": {
      "type": "array",
      "minItems": 1,
      "items": {
        "type": "object",
        "required": [
          "id",
          "lifecycle_status"
        ],
        "properties": {
          "id": {
            "type": "string",
            "minLength": 1
          },
          "lifecycle_status": {
            "enum": [
              "live",
              "simulation",
              "pending",
              "deprecated"
            ]
          }
        },
        "additionalProperties": true
      }
    }
  },
  "additionalProperties": false
}
